{
  "schemaVersion": 2,
  "catalogId": "example-agent-skills",
  "lockSha256": "05e611ccef7f40ba72cd20fec64c5ee4d09f14ecedabeebb0952102aa5e03fa7",
  "files": [
    {
      "artifactType": "instruction",
      "artifactId": "codex-base",
      "sourceId": "ai-instructions",
      "sourceRepository": "https://example.com/acme/ai-instructions.git",
      "sourceRef": "v2.0.0",
      "sourceCommit": "89abcdef0123456789abcdef0123456789abcdef",
      "sourceVersion": "2.0.0",
      "sourcePath": ".codex/AGENTS.en.md",
      "targetPath": "AGENTS.md",
      "sha256": "dddddddddddddddddddddddddddddddddddddddddddddddddddddddddddddddd"
    },
    {
      "artifactType": "skill",
      "artifactId": "work-with-jira",
      "sourceId": "agent-skills",
      "sourceRepository": "https://github.com/example/agent-skills-catalog.git",
      "sourceRef": "v1.0.0",
      "sourceCommit": "0123456789abcdef0123456789abcdef01234567",
      "sourceVersion": "1.0.0",
      "sourcePath": ".agents/skills/work-with-jira/SKILL.md",
      "targetPath": ".agents/skills/work-with-jira/SKILL.md",
      "sha256": "eeeeeeeeeeeeeeeeeeeeeeeeeeeeeeeeeeeeeeeeeeeeeeeeeeeeeeeeeeeeeeee"
    }
  ]
}
